<!ELEMENT branches (branch+)>
<!ELEMENT branch (address, contact, hours, mapLink)>
<!ELEMENT address (#PCDATA)>
<!ELEMENT contact (#PCDATA)>
<!ELEMENT hours (#PCDATA)>
<!ELEMENT mapLink (#PCDATA)>